{
  "schema_version": "skills-hub.auth-driver/v1",
  "credential_mode": "external-env",
  "method": "service-account",
  "flow": "non-interactive-service",
  "runtimes": ["codex", "claude", "generic"],
  "bootstrap": {"command": ["scripts/bigquery_auth_driver.mjs", "service-account", "bootstrap"]},
  "credential": {"command": ["scripts/bigquery_auth_driver.mjs", "service-account", "credential"]},
  "status": {"command": ["scripts/bigquery_auth_driver.mjs", "service-account", "status"]}
}
